{
  "$schema": "../../../../schemas/proposed-change-set.schema.json",
  "version": "0.1.0",
  "change_set_id": "PCS-2026-07-03-001",
  "status": "applied",
  "change_order_id": "CO-2026-001",
  "source_registry_path": "docs/product/sources/product-source-registry.json",
  "revision_state_path": "docs/product/revisions/co-2026-001-source-revision/revision-approval-state.json",
  "ledger_path": "docs/product/revisions/co-2026-001-source-revision/revision-ledger.md",
  "created_at": "2026-07-03T12:00:00Z",
  "updated_at": "2026-07-04T15:06:52Z",
  "acceptance_records": [
    {
      "acceptance_id": "AR-CO-2026-001-PO-001",
      "accepted_by_role": "Product Owner",
      "actor_identity": "current_user",
      "acceptance_channel": "codex_chat",
      "source_trust_level": "direct_product_owner_answer",
      "interaction_id": "CO-2026-001-PRODUCT-01",
      "accepted_at": "2026-07-03T09:00:00Z",
      "selected_option_id": "accepted",
      "evidence_path": "docs/product/change-orders/co-2026-001-acceptance-questionnaire-log.md",
      "original_user_answer_hash": "not_recorded_in_current_artifact",
      "related_edit_ids": [],
      "safe_summary": "Product Owner принял CO-2026-001 как смену продуктового приоритета."
    },
    {
      "acceptance_id": "AR-CO-2026-001-EDIT-001",
      "accepted_by_role": "Product Owner",
      "actor_identity": "current_user",
      "acceptance_channel": "codex_chat",
      "source_trust_level": "direct_product_owner_answer",
      "interaction_id": "CO-2026-001-REVISION-EDIT-001",
      "accepted_at": "2026-07-03T12:29:47Z",
      "selected_option_id": "variant_1_recommended",
      "evidence_path": "docs/product/revisions/co-2026-001-source-revision/revision-approval-log.md",
      "original_user_answer_hash": "6b86b273ff34fce19d6b804eff5a3f5747ada4eaa22f1d49c01e52ddb7875b4b",
      "related_edit_ids": ["EDIT-001"],
      "safe_summary": "Product Owner выбрал вариант 1 для EDIT-001: разделить основной сценарий Vision на запуск другим агентом и диалоговый режим в Лисе."
    },
    {
      "acceptance_id": "AR-CO-2026-001-EDIT-002",
      "accepted_by_role": "Product Owner",
      "actor_identity": "current_user",
      "acceptance_channel": "codex_chat",
      "source_trust_level": "direct_product_owner_answer",
      "interaction_id": "CO-2026-001-REVISION-EDIT-002",
      "accepted_at": "2026-07-03T12:45:00Z",
      "selected_option_id": "variant_1_recommended",
      "evidence_path": "docs/product/revisions/co-2026-001-source-revision/revision-approval-log.md",
      "original_user_answer_hash": "7f0e5b138ea611a617611881298b4e90332485d6c7ae7f73454f63c0bcc12557",
      "related_edit_ids": ["EDIT-002"],
      "safe_summary": "Product Owner принял вариант 1 для EDIT-002: переписать BMC на стейкхолдерском языке, разделив запуск другим агентом, диалоговый режим в Лисе и доставку файла по электронной почте."
    },
    {
      "acceptance_id": "AR-CO-2026-001-EDIT-003",
      "accepted_by_role": "Product Owner",
      "actor_identity": "current_user",
      "acceptance_channel": "codex_chat",
      "source_trust_level": "direct_product_owner_answer",
      "interaction_id": "CO-2026-001-REVISION-EDIT-003",
      "accepted_at": "2026-07-03T13:20:00Z",
      "selected_option_id": "variant_1_with_po_clarification",
      "evidence_path": "docs/product/revisions/co-2026-001-source-revision/revision-approval-log.md",
      "original_user_answer_hash": "c977dbe785221d34114d345fdf8ff4e18bb4af66750751dbea29407f9738735f",
      "related_edit_ids": ["EDIT-003"],
      "safe_summary": "Product Owner принял финальный текст для EDIT-003 — правки бизнес-требований по разделению режимов: в Лисе пользователь после описания структуры выбирает изготовление презентации или редактирование структуры; при запуске другим агентом подтверждение невозможно и не требуется."
    },
    {
      "acceptance_id": "AR-CO-2026-001-EDIT-004",
      "accepted_by_role": "Product Owner",
      "actor_identity": "current_user",
      "acceptance_channel": "codex_chat",
      "source_trust_level": "direct_product_owner_answer",
      "interaction_id": "CO-2026-001-REVISION-EDIT-004",
      "accepted_at": "2026-07-04T12:06:44Z",
      "selected_option_id": "variant_1_recommended",
      "evidence_path": "docs/product/revisions/co-2026-001-source-revision/revision-approval-log.md",
      "original_user_answer_hash": "6b86b273ff34fce19d6b804eff5a3f5747ada4eaa22f1d49c01e52ddb7875b4b",
      "related_edit_ids": ["EDIT-004"],
      "safe_summary": "Product Owner принял вариант 1 для EDIT-004 — правки критериев приемки по двум маршрутам: явно разделить запуск другим агентом без подтверждения после проверок и диалоговый режим в Лисе с выбором изготовления или редактирования структуры."
    },
    {
      "acceptance_id": "AR-CO-2026-001-EDIT-005",
      "accepted_by_role": "Product Owner",
      "actor_identity": "current_user",
      "acceptance_channel": "codex_chat",
      "source_trust_level": "direct_product_owner_answer",
      "interaction_id": "CO-2026-001-REVISION-EDIT-005",
      "accepted_at": "2026-07-04T12:52:48Z",
      "selected_option_id": "variant_5_with_po_lisa_notification_clarification",
      "evidence_path": "docs/product/revisions/co-2026-001-source-revision/revision-approval-log.md",
      "original_user_answer_hash": "dfb7d3244d829dad4eced5a9d012671b6f814c0501f27171251c95df680d13d6",
      "related_edit_ids": ["EDIT-005"],
      "safe_summary": "Product Owner согласовал EDIT-005 — правку BA-утверждений по каналу доставки: файл доставляется пользователю по электронной почте; при запуске другим агентом вызывающий агент получает статусы и сведения о результате; в Лисе пользователь получает сообщение о сроке доставки до 30 минут и уведомление после отправки файла."
    },
    {
      "acceptance_id": "AR-CO-2026-001-EDIT-006",
      "accepted_by_role": "Product Owner",
      "actor_identity": "current_user",
      "acceptance_channel": "codex_chat",
      "source_trust_level": "direct_product_owner_answer",
      "interaction_id": "CO-2026-001-REVISION-EDIT-006",
      "accepted_at": "2026-07-04T13:18:29Z",
      "selected_option_id": "variant_1_recommended",
      "evidence_path": "docs/product/revisions/co-2026-001-source-revision/revision-approval-log.md",
      "original_user_answer_hash": "6b86b273ff34fce19d6b804eff5a3f5747ada4eaa22f1d49c01e52ddb7875b4b",
      "related_edit_ids": ["EDIT-006"],
      "safe_summary": "Product Owner принял вариант 1 для EDIT-006 — правки системного анализа по маршруту без подтверждения: запуск другим агентом после проверки достаточности и безопасности данных идет к изготовлению, экспорту и доставке без ручного подтверждения; режим Лисы сохраняет пользовательский выбор после описания структуры."
    },
    {
      "acceptance_id": "AR-CO-2026-001-EDIT-007",
      "accepted_by_role": "Product Owner",
      "actor_identity": "current_user",
      "acceptance_channel": "codex_chat",
      "source_trust_level": "direct_product_owner_answer",
      "interaction_id": "CO-2026-001-REVISION-EDIT-007",
      "accepted_at": "2026-07-04T14:46:58Z",
      "selected_option_id": "accepted_recommended_main_text_with_technical_boundary_in_non_goals",
      "evidence_path": "docs/product/revisions/co-2026-001-source-revision/revision-approval-log.md",
      "original_user_answer_hash": "43a4e3906d9a836cf6ba6623ad179124aef987ad55be9d741ea1294c3e611dd1",
      "related_edit_ids": ["EDIT-007"],
      "safe_summary": "Product Owner принял EDIT-007 — правку feature spec по решению о доставке: основной текст фиксирует принятое решение о доставке без перегруженной технической оговорки, а граница по реальным сетевым, почтовым интеграциям и интеграциям инструментов сохраняется в технических ограничениях пакета спецификаций."
    },
    {
      "acceptance_id": "AR-CO-2026-001-EDIT-008",
      "accepted_by_role": "Product Owner",
      "actor_identity": "current_user",
      "acceptance_channel": "codex_chat",
      "source_trust_level": "direct_product_owner_answer",
      "interaction_id": "CO-2026-001-REVISION-EDIT-008",
      "accepted_at": "2026-07-04T15:06:52Z",
      "selected_option_id": "variant_3_recommended",
      "evidence_path": "docs/product/revisions/co-2026-001-source-revision/revision-approval-log.md",
      "original_user_answer_hash": "ae347f0c7028acbf9bfef705b87806451125b155a3afa658ce222681de2d2140",
      "related_edit_ids": ["EDIT-008"],
      "safe_summary": "Product Owner принял вариант 3 для EDIT-008 — правки матрицы трассировки по двум режимам: для BT-009, BT-012 и BT-014 добавляются отдельные связи по режиму Лисы и запуску другим агентом."
    }
  ],
  "proposed_edits": [
    {
      "edit_id": "EDIT-001",
      "artifact_path": "docs/product-vision.md",
      "section_or_anchor": "Основной пользовательский сценарий",
      "change_kind": "conceptual_product",
      "current_excerpt": "DataCanvas работает в двух режимах.",
      "proposed_text": "Разделить сценарий на два маршрута: запуск другим агентом без подтверждения после проверки достаточности и безопасности данных; диалоговый режим в Лисе с уточняющими вопросами, просмотром структуры и правками до генерации.",
      "rationale": "Текущий сценарий смешивает агентский запуск и режим Лисы, хотя CO-2026-001 разделил эти маршруты.",
      "affected_claims": ["CO-2026-001", "PRODUCT-21"],
      "downstream_paths": [
        "docs/product/requirements/business-requirements.md",
        "docs/product/requirements/acceptance-criteria.md",
        "docs/product/requirements/traceability-matrix.json"
      ],
      "required_owner": "Product Owner",
      "approval_status": "approved",
      "apply_status": "applied",
      "validation_status": "passed",
      "acceptance_record_id": "AR-CO-2026-001-EDIT-001",
      "rollback_or_forward_fix": "Если PO отклонит разделение, сохранить no-change rationale и пересмотреть CO impact."
    },
    {
      "edit_id": "EDIT-002",